{
  "base_currency": "BTC",
  "base_currency_scale": 8,
  "counter_currency": "USD",
  "counter_currency_scale": 2,
  "min_price_increment": 72525.0,
  "min_price_increment_scale": 8,
  "min_order_size": 1,
  "min_order_size_scale": 8,
  "max_order_size": 1,
  "max_order_size_scale": 8,
  "lot_size": 1,
  "lot_size_scale": 8,
  "status": "open",
  "id": 1,
  "auction_price": 72525.0,
  "auction_size": 1.0,
  "auction_time": 1748609400000,
  "imbalance": 1.0
}
